[
  {
    "id": "00-void",
    "name": "Black Madonna",
    "type": "archetype",
    "numerology": 0,
    "lore": "Primordial Void; Holy Fool.",
    "art": "data:image/png;base64,iVBORw0KGgoAAAANSUhEUgAAAAEAAAABCAQAAAC1HAwCAAAAC0lEQVR42mP8/x8AAwMCAO8N0a8AAAAASUVORK5CYII=",
    "lab": "labs/void-lab.html",
    "links": ["01-magician"],
    "tags": ["origin", "aurora-gate"],
    "provenance": ["Codex 144:99"],
    "updated": "2024-06-01"
  },
  {
    "id": "01-magician",
    "name": "The Magician",
    "type": "tarot",
    "numerology": 1,
    "lore": "Master of manifestation and will.",
    "art": "",
    "lab": "",
    "links": ["00-void"],
    "tags": ["major-arcana"],
    "provenance": ["Codex 144:99"],
    "updated": "2024-06-01"
  }
]
